[
  {
    "name": "Algeria",
    "iso3": "DZA",
    "region": "North Africa",
    "status": "general",
    "actor": "General legal coverage",
    "summary": "Algeria is named among the significant digital economies that still rely on broader cybercrime, penal, or data protection law rather than a dedicated child online protection framework.",
    "instruments": [
      "General cybercrime, penal, or data protection coverage"
    ],
    "flags": [
      "General framework",
      "Named digital economy",
      "No dedicated COP framework"
    ],
    "evidence": "Algeria falls inside the large general-law category rather than the dedicated COP categories.",
    "opportunity": "Use domestication advocacy to move from tangential legal coverage toward a child-specific framework.",
    "articleRefs": [
      "4.1 The Numbers, paragraph 22"
    ]
  },
  {
    "name": "Burundi",
    "iso3": "BDI",
    "region": "East Africa",
    "status": "none",
    "actor": "No identifiable framework",
    "summary": "Burundi has no identifiable legislation, regulation, or policy framework on child online safety.",
    "instruments": [
      "No identifiable child online safety framework"
    ],
    "flags": [
      "No framework",
      "Gap state",
      "East Africa"
    ],
    "evidence": "Burundi is one of the five countries with no identifiable child online safety framework.",
    "opportunity": "Link agenda-setting to AU domestication pressure and sub-regional standards.",
    "articleRefs": [
      "4.1 The Numbers, paragraph 23"
    ],
    "x": 521,
    "y": 434
  },
  {
    "name": "Cameroon",
    "iso3": "CMR",
    "region": "Central Africa",
    "status": "binding",
    "actor": "Parliament / ANTIC",
    "summary": "Cameroon sits in the top-tier binding group, while its framework remains robust and multi-layered rather than a standalone COP statute.",
    "instruments": [
      "Charter on Child Online Protection in Cameroon - Law No. 2023/009 of July 25, 2023"
    ],
    "flags": [
      "Top-tier binding group",
      "Francophone momentum",
      "Institutional champion"
    ],
    "evidence": "Cameroon appears both in the top-tier count and in the Francophone acceleration pattern.",
    "opportunity": "Use Cameroon as a Francophone peer case for sub-regional harmonisation and institutional champion strategy.",
    "articleRefs": [
      "Executive Summary, paragraph 8",
      "4.1 The Numbers, paragraph 19",
      "4.2 The Patterns, paragraph 26",
      "6.1 Drivers, paragraph 48"
    ],
    "x": 360,
    "y": 366
  },
  {
    "name": "Cote d'Ivoire",
    "iso3": "CIV",
    "region": "West Africa",
    "status": "general",
    "actor": "General legal coverage",
    "summary": "Cote d'Ivoire is named among significant digital economies that still rely on broader cybercrime, penal, or data protection law without a dedicated COP framework.",
    "instruments": [
      "General cybercrime, penal, or data protection coverage"
    ],
    "flags": [
      "General framework",
      "Named digital economy",
      "No dedicated COP framework"
    ],
    "evidence": "Cote d'Ivoire falls inside the general-law category rather than the dedicated COP categories.",
    "opportunity": "Frame Cote d'Ivoire as a priority domestication target inside broader West African harmonisation work.",
    "articleRefs": [
      "4.1 The Numbers, paragraph 22"
    ]
  },
  {
    "name": "Djibouti",
    "iso3": "DJI",
    "region": "East Africa",
    "status": "general",
    "actor": "Digital Code pathway",
    "summary": "Djibouti is cited as having adopted a Digital Code in 2025, signalling legislative movement in Francophone Africa without a dedicated COP framework.",
    "instruments": [
      "Digital Code 2025"
    ],
    "flags": [
      "General framework",
      "Francophone development",
      "Digital code"
    ],
    "evidence": "Djibouti shows that Francophone legal movement is broadening beyond the earlier leaders.",
    "opportunity": "Press broad digital-code architecture toward child-specific obligations rather than generic digital governance.",
    "articleRefs": [
      "4.2 The Patterns, paragraph 26"
    ],
    "x": 539,
    "y": 331
  },
  {
    "name": "Egypt",
    "iso3": "EGY",
    "region": "North Africa",
    "status": "general",
    "actor": "General legal coverage",
    "summary": "Egypt is named among the significant digital economies that rely on general cybercrime, penal, or data protection laws with only tangential relevance to child online safety.",
    "instruments": [
      "General cybercrime, penal, or data protection coverage"
    ],
    "flags": [
      "General framework",
      "Named digital economy",
      "No dedicated COP framework"
    ],
    "evidence": "Egypt sits in the general-law category rather than the dedicated COP categories.",
    "opportunity": "Use Egypt as a high-visibility domestication target given its scale and regional influence.",
    "articleRefs": [
      "4.1 The Numbers, paragraph 22"
    ]
  },
  {
    "name": "Eritrea",
    "iso3": "ERI",
    "region": "East Africa",
    "status": "none",
    "actor": "No identifiable framework",
    "summary": "Eritrea has no identifiable legislation, regulation, or policy framework on child online safety.",
    "instruments": [
      "No identifiable child online safety framework"
    ],
    "flags": [
      "No framework",
      "Gap state",
      "Priority watch"
    ],
    "evidence": "Eritrea is one of five countries in the no-framework category.",
    "opportunity": "Use AU pressure to establish a minimum policy foothold.",
    "articleRefs": [
      "4.1 The Numbers, paragraph 23"
    ],
    "x": 541,
    "y": 299
  },
  {
    "name": "Eswatini",
    "iso3": "SWZ",
    "region": "Southern Africa",
    "status": "strategy",
    "actor": "Guidelines pathway",
    "summary": "Eswatini is cited as having five-part COP Guidelines, indicating policy growth without the permanence or enforcement teeth of primary legislation.",
    "instruments": [
      "Five-part COP Guidelines"
    ],
    "flags": [
      "Guidelines only",
      "Policy expansion",
      "No primary legislation"
    ],
    "evidence": "Eswatini sits in the guideline-and-strategy layer rather than the legislative layer.",
    "opportunity": "Use the guideline base to press for legislative anchoring and implementation accountability.",
    "articleRefs": [
      "4.2 The Patterns, paragraph 27"
    ]
  },
  {
    "name": "Ethiopia",
    "iso3": "ETH",
    "region": "East Africa",
    "status": "general",
    "actor": "General legal coverage",
    "summary": "Ethiopia is named as a significant digital economy that still relies on broader legal frameworks rather than dedicated COP instruments.",
    "instruments": [
      "General cybercrime, penal, or data protection coverage"
    ],
    "flags": [
      "General framework",
      "Named digital economy",
      "Priority target"
    ],
    "evidence": "Ethiopia sits in the large general-law category and remains a strategic advocacy focus.",
    "opportunity": "Use high-level domestication pressure and CRC-linked advocacy to move toward dedicated child online protection coverage.",
    "articleRefs": [
      "4.1 The Numbers, paragraph 22"
    ],
    "x": 527,
    "y": 360
  },
  {
    "name": "Gabon",
    "iso3": "GAB",
    "region": "Central Africa",
    "status": "general",
    "actor": "Age verification ordinance",
    "summary": "Gabon’s 2026 Social Media Age Verification Ordinance is cited as a notable Francophone development on age assurance without full dedicated COP coverage.",
    "instruments": [
      "Social Media Age Verification Ordinance 2026"
    ],
    "flags": [
      "Age verification",
      "Francophone development",
      "General framework"
    ],
    "evidence": "Gabon appears both in the Francophone pattern and the age-verification gap discussion.",
    "opportunity": "Push age-assurance debates toward rights-respecting standards, transparency, and child-specific design obligations.",
    "articleRefs": [
      "4.2 The Patterns, paragraph 26",
      "5. Structural Gaps, paragraph 34"
    ],
    "x": 372,
    "y": 425
  },
  {
    "name": "Gambia",
    "iso3": "GMB",
    "region": "West Africa",
    "status": "none",
    "actor": "No identifiable framework",
    "summary": "Gambia has no identifiable child online safety legislation, regulation, or policy framework.",
    "instruments": [
      "No identifiable child online safety framework"
    ],
    "flags": [
      "No framework",
      "Gap state",
      "West Africa"
    ],
    "evidence": "Gambia is named directly in the no-framework group.",
    "opportunity": "Build the case for a baseline child-protection and digital-rights entry point.",
    "articleRefs": [
      "4.1 The Numbers, paragraph 23"
    ],
    "x": 205,
    "y": 328
  },
  {
    "name": "Ghana",
    "iso3": "GHA",
    "region": "West Africa",
    "status": "binding",
    "actor": "Cyber Security Authority",
    "summary": "Ghana has a Cybersecurity Act with child-specific provisions and a National COP Framework issued in 2024.",
    "instruments": [
      "Cybersecurity Act 2020 with child-specific provisions",
      "National Child Online Protection Framework 2024"
    ],
    "flags": [
      "Binding coverage",
      "National framework",
      "Institutional champion"
    ],
    "evidence": "Ghana is one of the jurisdictions with binding child online safety coverage.",
    "opportunity": "Use Ghana as a benchmark for institutional mandate, implementation design, and regional peer pressure.",
    "articleRefs": [
      "4.1 The Numbers, paragraph 19",
      "6.1 Drivers, paragraph 48"
    ],
    "x": 286,
    "y": 392
  },
  {
    "name": "Guinea-Bissau",
    "iso3": "GNB",
    "region": "West Africa",
    "status": "none",
    "actor": "No identifiable framework",
    "summary": "Guinea-Bissau is listed as having no identifiable child online safety framework.",